{
  "$schema": "../brand.schema.json",
  "name": "iris",
  "label": "Iris",
  "default": false,
  "description": "Indigo-violet identity for developer platforms and payments: crisp, confident and light-first on cool greys.",
  "seed": "#635BFF",
  "status": {
    "success": "#12B76A",
    "warning": "#F79009",
    "danger": "#D92D20",
    "info": "#2E90FA"
  },
  "neutral": {
    "tint": 0.012
  },
  "radius": "0.375rem",
  "fonts": {
    "body": "\"Geist\", ui-sans-serif, system-ui, -apple-system, \"Segoe UI\", Roboto, Arial, sans-serif",
    "ar": "\"Cairo\", \"Segoe UI\", Tahoma, Arial, sans-serif",
    "hi": "\"Noto Sans Devanagari\", \"Nirmala UI\", Mangal, ui-sans-serif, system-ui, sans-serif",
    "title": "\"Geist\", ui-sans-serif, system-ui, sans-serif",
    "code": "\"JetBrains Mono\", ui-monospace, SFMono-Regular, Menlo, Consolas, monospace"
  },
  "overrides": {
    "light": {},
    "dark": {}
  }
}
