{
  "$schema": "../brand.schema.json",
  "name": "neutral",
  "label": "Neutral",
  "default": false,
  "description": "Monochrome identity: black on white in light mode, white on black in dark mode. Colour is reserved for status.",
  "seed": "#171717",
  "status": {
    "success": "#12B76A",
    "warning": "#F79009",
    "danger": "#D92D20",
    "info": "#2E90FA"
  },
  "neutral": {
    "tint": 0
  },
  "radius": "0.5rem",
  "fonts": {
    "body": "\"Geist\", ui-sans-serif, system-ui, -apple-system, \"Segoe UI\", Roboto, Arial, sans-serif",
    "ar": "\"Cairo\", \"Segoe UI\", Tahoma, Arial, sans-serif",
    "hi": "\"Noto Sans Devanagari\", \"Nirmala UI\", Mangal, ui-sans-serif, system-ui, sans-serif",
    "title": "\"Geist\", ui-sans-serif, system-ui, sans-serif",
    "code": "\"JetBrains Mono\", ui-monospace, SFMono-Regular, Menlo, Consolas, monospace"
  },
  "overrides": {
    "light": {
      "primary": "{neutral.950}",
      "primary-foreground": "{neutral.0}",
      "primary-hover": "{neutral.800}",
      "primary-active": "{neutral.700}",
      "ring": "{neutral.500}",
      "brand": "{neutral.950}",
      "brand-foreground": "{neutral.0}",
      "sidebar-primary": "{neutral.950}",
      "sidebar-primary-foreground": "{neutral.0}",
      "sidebar-ring": "{neutral.500}",
      "chart-1": "{neutral.900}"
    },
    "dark": {
      "primary": "{neutral.0}",
      "primary-foreground": "{neutral.950}",
      "primary-hover": "{neutral.200}",
      "primary-active": "{neutral.300}",
      "ring": "{neutral.400}",
      "brand": "{neutral.0}",
      "brand-foreground": "{neutral.950}",
      "sidebar-primary": "{neutral.0}",
      "sidebar-primary-foreground": "{neutral.950}",
      "sidebar-ring": "{neutral.400}",
      "chart-1": "{neutral.100}"
    }
  }
}
