{
  "$schema": "../brand.schema.json",
  "name": "slate",
  "label": "Slate",
  "default": false,
  "description": "Cool grey identity for dense, data-heavy tools. Colour is spent on data, not chrome.",
  "seed": "#475569",
  "status": {
    "success": "#12B76A",
    "warning": "#F79009",
    "danger": "#D92D20",
    "info": "#2E90FA"
  },
  "neutral": {
    "tint": 0.008
  },
  "radius": "0.375rem",
  "fonts": {
    "body": "\"Geist\", ui-sans-serif, system-ui, -apple-system, \"Segoe UI\", Roboto, Arial, sans-serif",
    "ar": "\"Cairo\", \"Segoe UI\", Tahoma, Arial, sans-serif",
    "hi": "\"Noto Sans Devanagari\", \"Nirmala UI\", Mangal, ui-sans-serif, system-ui, sans-serif",
    "title": "\"Geist\", ui-sans-serif, system-ui, sans-serif",
    "code": "\"JetBrains Mono\", ui-monospace, SFMono-Regular, Menlo, Consolas, monospace"
  },
  "overrides": {
    "light": {
      "chart-1": "{brand}",
      "chart-5": "{brand.-3}"
    },
    "dark": {
      "primary": "{brand.-2}",
      "primary-foreground": "{on:brand.-2}",
      "primary-hover": "{brand.-3}",
      "primary-active": "{brand.-1}",
      "ring": "{brand.-2}",
      "brand": "{brand.-2}",
      "brand-foreground": "{on:brand.-2}",
      "sidebar-primary": "{brand.-2}",
      "sidebar-primary-foreground": "{on:brand.-2}",
      "sidebar-ring": "{brand.-2}",
      "chart-1": "{brand.-2}"
    }
  }
}
