{
  "$schema": "../brand.schema.json",
  "name": "ember",
  "label": "Ember",
  "default": false,
  "description": "Warm commerce orange: energetic calls to action on warm-tinted greys.",
  "seed": "#EA580C",
  "status": {
    "success": "#12B76A",
    "warning": "#B54708",
    "danger": "#D92D20",
    "info": "#2E90FA"
  },
  "neutral": {
    "tint": 0.006
  },
  "radius": "0.625rem",
  "fonts": {
    "body": "\"Geist\", ui-sans-serif, system-ui, -apple-system, \"Segoe UI\", Roboto, Arial, sans-serif",
    "ar": "\"Cairo\", \"Segoe UI\", Tahoma, Arial, sans-serif",
    "hi": "\"Noto Sans Devanagari\", \"Nirmala UI\", Mangal, ui-sans-serif, system-ui, sans-serif",
    "title": "\"Geist\", ui-sans-serif, system-ui, sans-serif",
    "code": "\"JetBrains Mono\", ui-monospace, SFMono-Regular, Menlo, Consolas, monospace"
  },
  "overrides": {
    "light": {},
    "dark": {}
  }
}
