{
  "$schema": "../brand.schema.json",
  "name": "forest",
  "label": "Forest",
  "default": false,
  "description": "Deep green identity for finance and health products: steady, legible, never neon.",
  "seed": "#15803D",
  "status": {
    "success": "#12B76A",
    "warning": "#F79009",
    "danger": "#D92D20",
    "info": "#2E90FA"
  },
  "neutral": {
    "tint": 0.005
  },
  "radius": "0.5rem",
  "fonts": {
    "body": "\"Geist\", ui-sans-serif, system-ui, -apple-system, \"Segoe UI\", Roboto, Arial, sans-serif",
    "ar": "\"Cairo\", \"Segoe UI\", Tahoma, Arial, sans-serif",
    "hi": "\"Noto Sans Devanagari\", \"Nirmala UI\", Mangal, ui-sans-serif, system-ui, sans-serif",
    "title": "\"Geist\", ui-sans-serif, system-ui, sans-serif",
    "code": "\"JetBrains Mono\", ui-monospace, SFMono-Regular, Menlo, Consolas, monospace"
  },
  "overrides": {
    "light": {},
    "dark": {
      "primary": "{brand.-1}",
      "primary-foreground": "{on:brand.-1}",
      "primary-hover": "{brand.-2}",
      "primary-active": "{brand}",
      "ring": "{brand.-1}",
      "brand": "{brand.-1}",
      "brand-foreground": "{on:brand.-1}",
      "sidebar-primary": "{brand.-1}",
      "sidebar-primary-foreground": "{on:brand.-1}",
      "sidebar-ring": "{brand.-1}",
      "chart-1": "{brand.-1}"
    }
  }
}
